{
  "snapshot_id": 1001,
  "scene_generation": 20,
  "game_day": 120,
  "game_build_id": "fixture-build",
  "cats": [
    {
      "id": 1,
      "name": "Alpha",
      "life_stage": "adult",
      "age_days": 100,
      "room_id": 1,
      "base_stats": {
        "strength": 8,
        "dexterity": 7,
        "constitution": 7,
        "intelligence": 3,
        "speed": 6,
        "luck": 5
      },
      "abilities": [
        "PowerStrike"
      ],
      "passives": [],
      "mutations": [
        "RareGlow"
      ],
      "disorders": [],
      "parents": [],
      "compatible_breeding_ids": [],
      "injured": false,
      "available_for_combat": true,
      "available_for_breeding": true,
      "player_favorite": false,
      "game_locked": false,
      "protection": "none"
    },
    {
      "id": 2,
      "name": "Beta",
      "life_stage": "adult",
      "age_days": 100,
      "room_id": 1,
      "base_stats": {
        "strength": 5,
        "dexterity": 5,
        "constitution": 6,
        "intelligence": 8,
        "speed": 7,
        "luck": 5
      },
      "abilities": [
        "Heal"
      ],
      "passives": [
        "Calm"
      ],
      "mutations": [],
      "disorders": [],
      "parents": [],
      "compatible_breeding_ids": [],
      "injured": false,
      "available_for_combat": true,
      "available_for_breeding": true,
      "player_favorite": false,
      "game_locked": false,
      "protection": "none"
    },
    {
      "id": 3,
      "name": "Gamma",
      "life_stage": "adult",
      "age_days": 100,
      "room_id": 2,
      "base_stats": {
        "strength": 4,
        "dexterity": 4,
        "constitution": 4,
        "intelligence": 4,
        "speed": 4,
        "luck": 4
      },
      "abilities": [],
      "passives": [],
      "mutations": [],
      "disorders": [
        "WeakBones"
      ],
      "parents": [],
      "compatible_breeding_ids": [],
      "injured": false,
      "available_for_combat": true,
      "available_for_breeding": true,
      "player_favorite": false,
      "game_locked": false,
      "protection": "none"
    },
    {
      "id": 4,
      "name": "Delta",
      "life_stage": "kitten",
      "age_days": 100,
      "room_id": 2,
      "base_stats": {
        "strength": 7,
        "dexterity": 7,
        "constitution": 7,
        "intelligence": 7,
        "speed": 7,
        "luck": 7
      },
      "abilities": [],
      "passives": [],
      "mutations": [
        "RareGlow"
      ],
      "disorders": [],
      "parents": [],
      "compatible_breeding_ids": [],
      "injured": false,
      "available_for_combat": false,
      "available_for_breeding": false,
      "player_favorite": false,
      "game_locked": false,
      "protection": "no_cull"
    },
    {
      "id": 5,
      "name": "Epsilon",
      "life_stage": "adult",
      "age_days": 100,
      "room_id": 2,
      "base_stats": {
        "strength": 2,
        "dexterity": 2,
        "constitution": 3,
        "intelligence": 2,
        "speed": 2,
        "luck": 2
      },
      "abilities": [],
      "passives": [],
      "mutations": [],
      "disorders": [],
      "parents": [],
      "compatible_breeding_ids": [],
      "injured": false,
      "available_for_combat": true,
      "available_for_breeding": true,
      "player_favorite": false,
      "game_locked": false,
      "protection": "none"
    },
    {
      "id": 6,
      "name": "Zeta",
      "life_stage": "adult",
      "age_days": 100,
      "room_id": 3,
      "base_stats": {
        "strength": 6,
        "dexterity": 6,
        "constitution": 6,
        "intelligence": 6,
        "speed": 6,
        "luck": 6
      },
      "abilities": [
        "Guard"
      ],
      "passives": [],
      "mutations": [],
      "disorders": [],
      "parents": [],
      "compatible_breeding_ids": [],
      "injured": true,
      "available_for_combat": true,
      "available_for_breeding": true,
      "player_favorite": false,
      "game_locked": false,
      "protection": "no_move"
    },
    {
      "id": 7,
      "name": "Eta",
      "life_stage": "adult",
      "age_days": 100,
      "room_id": 3,
      "base_stats": {
        "strength": 3,
        "dexterity": 3,
        "constitution": 3,
        "intelligence": 3,
        "speed": 3,
        "luck": 3
      },
      "abilities": [],
      "passives": [],
      "mutations": [],
      "disorders": [],
      "parents": [],
      "compatible_breeding_ids": [],
      "injured": false,
      "available_for_combat": true,
      "available_for_breeding": true,
      "player_favorite": false,
      "game_locked": false,
      "protection": "none"
    }
  ],
  "rooms": [
    {
      "id": 1,
      "room_type": "breeding",
      "residents": [
        1,
        2
      ],
      "hard_capacity": 2,
      "soft_capacity": 2,
      "comfort": 8,
      "stimulation": 9,
      "allows_breeding": true,
      "allows_kittens": false,
      "is_special_room": false,
      "player_locked": false
    },
    {
      "id": 2,
      "room_type": "general",
      "residents": [
        3,
        4,
        5
      ],
      "hard_capacity": 4,
      "soft_capacity": 3,
      "comfort": 5,
      "stimulation": 4,
      "allows_breeding": false,
      "allows_kittens": true,
      "is_special_room": false,
      "player_locked": false
    },
    {
      "id": 3,
      "room_type": "combat_staging",
      "residents": [
        6,
        7
      ],
      "hard_capacity": 4,
      "soft_capacity": 3,
      "comfort": 7,
      "stimulation": 5,
      "allows_breeding": false,
      "allows_kittens": false,
      "is_special_room": false,
      "player_locked": false
    }
  ]
}